{
  "channel": "stable",
  "edition": "standard",
  "latest": "1.0.3",
  "releases": {
    "1.0.3": {
      "published_at": "2026-07-31T00:00:00Z",
      "min_version": "1.0.0",
      "architectures": {
        "amd64": {
          "artifact": "Equate-1.0.3-amd64.eqa",
          "url": "https://equateupdates.blob.core.windows.net/updates/v1/channel/stable/1.0.3/Equate-1.0.3-amd64.eqa",
          "sha256": "0123456789abcdef0123456789abcdef0123456789abcdef0123456789abcdef",
          "size_bytes": 2147483648,
          "signature": "BASE64_ED25519_SIGNATURE_PLACEHOLDER"
        }
      }
    }
  }
}
